{
  "schemaVersion": 1,
  "attemptId": "synthetic-attempt-001",
  "runId": "synthetic-run-001",
  "ordinal": 1,
  "seed": 7,
  "lifecycleStatus": "succeeded",
  "agentOutcome": "completed",
  "executionClassification": "completed",
  "agentNetworkId": "synthetic-agent-network",
  "evaluationNetworkId": "synthetic-evaluation-network",
  "submissionSnapshotDigest": "sha256:4444"
}
